{"$schema":"https://json-schema.org/draft/2020-12/schema","additionalProperties":false,"description":"v1.2: campos opcionales G1-D por caso (territorial_bases/expected_territorial_basis/territorial_basis_match/legal_basis_match) y run.metamorphic_cases_excluded. Runs v1.1 validos. G1-D-F03: summary.match_metrics (probe_satisfaction + strict_exact_set) y strict_exact_set_match/strict_divergences por caso.","properties":{"cases":{"items":{"additionalProperties":false,"properties":{"assertion_evaluations":{"items":{"additionalProperties":false,"properties":{"assertion_id":{"type":"string"},"effective_from":{"$ref":"v1/common/temporal.schema.json#/$defs/iso_date"},"effective_legal_effect_at_as_of":{"enum":["ENTITLED_TO_PROVIDE","NOT_ENTITLED","UNKNOWN"],"type":"string"},"effective_to":{"$ref":"v1/common/temporal.schema.json#/$defs/iso_date_nullable"},"evidence":{"items":{"$ref":"v1/common/provenance.schema.json#/$defs/source_assertion"},"type":"array"},"legal_basis":{"type":"string"},"reason":{"type":"string"},"register_id":{"type":"string"},"source_legal_effect":{"enum":["ENTITLED_TO_PROVIDE","NOT_ENTITLED","UNKNOWN"],"type":"string"}},"required":["assertion_id","register_id","source_legal_effect","effective_legal_effect_at_as_of","effective_from","effective_to","reason","legal_basis","evidence"],"type":"object"},"type":"array"},"assessment":{"enum":["CONFIRMED_ENTITLED","NO_ENTITLEMENT_EVIDENCED","CONFIRMED_NOT_ENTITLED","INDETERMINATE"],"type":"string"},"case_id":{"type":"string"},"derived_assertion_ids":{"items":{"type":"string"},"type":"array"},"diagnostics":{"items":{"type":"string"},"type":"array"},"entry_mechanism_match":{"type":"boolean"},"entry_mechanisms":{"items":{"type":"string"},"type":"array"},"expected_assessment":{"type":["string","null"]},"expected_entry_mechanism":{"type":["string","null"]},"expected_reason":{"type":["string","null"]},"expected_territorial_basis":{"items":{"type":"string"},"type":["array","null"]},"identity_resolution":{"enum":["EXACT","AMBIGUOUS","NOT_FOUND","CONFLICTING_IDENTIFIERS"],"type":"string"},"legal_basis_match":{"type":"boolean"},"match":{"type":"boolean"},"matched_reported_fact_ids":{"items":{"type":"string"},"type":"array"},"matching_assertion_ids":{"items":{"type":"string"},"type":"array"},"query":{"additionalProperties":false,"properties":{"activity":{"type":"string"},"as_of":{"$ref":"v1/common/temporal.schema.json#/$defs/iso_date"},"entity_id":{"type":"string"},"jurisdiction":{"type":"string"}},"required":["entity_id","activity","jurisdiction","as_of"],"type":"object"},"reason":{"type":"string"},"reason_match":{"type":"boolean"},"source_claim_ids":{"items":{"type":"string"},"type":"array"},"strict_divergences":{"items":{"type":"string"},"type":"array"},"strict_exact_set_match":{"type":"boolean"},"territorial_bases":{"items":{"type":"string"},"type":"array"},"territorial_basis_match":{"type":"boolean"},"used_assertion_ids":{"items":{"type":"string"},"type":"array"}},"required":["case_id","query","identity_resolution","assessment","reason","diagnostics","matching_assertion_ids","used_assertion_ids","derived_assertion_ids","source_claim_ids","assertion_evaluations","expected_assessment","expected_reason","match","reason_match","matched_reported_fact_ids","entry_mechanisms","expected_entry_mechanism","entry_mechanism_match"],"type":"object"},"type":"array"},"result_sha":{"$ref":"v1/common/identifiers.schema.json#/$defs/sha256"},"run":{"additionalProperties":false,"properties":{"assessment_cases_sha256":{"$ref":"v1/common/identifiers.schema.json#/$defs/sha256"},"claims_ledger_sha256":{"$ref":"v1/common/identifiers.schema.json#/$defs/sha256"},"code_commit":{"type":["string","null"]},"code_files":{"items":{"additionalProperties":false,"properties":{"path":{"type":"string"},"sha256":{"$ref":"v1/common/identifiers.schema.json#/$defs/sha256"}},"required":["path","sha256"],"type":"object"},"type":"array"},"code_sha":{"$ref":"v1/common/identifiers.schema.json#/$defs/sha256"},"corpus_sha256":{"$ref":"v1/common/identifiers.schema.json#/$defs/sha256"},"derivation_ruleset_sha256":{"$ref":"v1/common/identifiers.schema.json#/$defs/sha256"},"derivation_version":{"type":"string"},"derived_assertions_sha256":{"$ref":"v1/common/identifiers.schema.json#/$defs/sha256"},"executed_at":{"$ref":"v1/common/temporal.schema.json#/$defs/iso_datetime"},"frozen_input_integrity":{"additionalProperties":{"type":"boolean"},"type":"object"},"gate":{"type":"string"},"metamorphic_cases_excluded":{"items":{"type":"string"},"type":"array"},"ruleset_version":{"type":"string"},"run_id":{"type":"string"},"run_version":{"type":"string"},"semantics_version":{"type":"string"}},"required":["run_id","run_version","gate","code_sha","code_files","code_commit","derivation_version","ruleset_version","corpus_sha256","claims_ledger_sha256","derivation_ruleset_sha256","assessment_cases_sha256","derived_assertions_sha256","frozen_input_integrity","executed_at","semantics_version"],"type":"object"},"summary":{"additionalProperties":false,"properties":{"assessments":{"additionalProperties":{"type":"integer"},"type":"object"},"cases_total":{"minimum":0,"type":"integer"},"match_metrics":{"additionalProperties":false,"properties":{"probe_satisfaction":{"additionalProperties":false,"properties":{"matches":{"minimum":0,"type":"integer"},"mismatches":{"items":{"type":"string"},"type":"array"}},"required":["matches","mismatches"],"type":"object"},"strict_exact_set":{"additionalProperties":false,"properties":{"divergences":{"items":{"type":"string"},"type":"array"},"matches":{"minimum":0,"type":"integer"}},"required":["matches","divergences"],"type":"object"}},"required":["probe_satisfaction","strict_exact_set"],"type":"object"},"matches":{"minimum":0,"type":"integer"},"mismatches":{"items":{"type":"string"},"type":"array"},"reason_mismatches":{"items":{"type":"string"},"type":"array"}},"required":["cases_total","matches","mismatches","reason_mismatches","assessments"],"type":"object"}},"required":["run","summary","cases","result_sha"],"title":"FinReg-ES assessment run v1.2","type":"object"}
