{"cases":[{"assertion_evaluations":[{"assertion_id":"g1d2-asm-077","effective_from":"2026-09-14","effective_legal_effect_at_as_of":"ENTITLED_TO_PROVIDE","effective_to":null,"evidence":[{"authority":"European Banking Authority (EBA)","extractor_version":"G1D_TERRITORIAL_EXTRACT_V1","observed_current":true,"raw_snapshot_sha256":"948429ad71ea0ccbc03abe8d21eab7082075e09377874852b0fd265c2e0e1f31","raw_value":"{\"fields\":{\"commercial_name\":\"fire.com\",\"country\":\"IE\",\"ent_aut_raw\":[\"2018-07-02\"],\"ent_aut_raw_type\":[\"2018-07-02\"],\"entity_code\":\"IE_CBI!C58301\",\"entity_type\":\"PSD_PI\",\"entity_version\":\"20260814223344848\",\"legal_name\":\"Fire Financial Services Limited\",\"national_reference_code\":\"C58301\",\"service_codes\":[{\"AT\":[\"PS_03A\",\"PS_03B\",\"PS_03C\",\"PS_05A\",\"PS_05B\",\"PS_070\",\"PS_080\"]},{\"BE\":[\"PS_03A\",\"PS_03B\",\"PS_03C\",\"PS_05A\",\"PS_05B\",\"PS_070\",\"PS_080\"]},{\"DE\":[\"PS_03A\",\"PS_03B\",\"PS_03C\",\"PS_05A\",\"PS_05B\",\"PS_070\",\"PS_080\"]},{\"ES\":[\"PS_03A\",\"PS_03B\",\"PS_03C\",\"PS_05A\",\"PS_05B\",\"PS_070\",\"PS_080\"]},{\"FI\":[\"PS_03A\",\"PS_03B\",\"PS_03C\",\"PS_05A\",\"PS_05B\",\"PS_070\",\"PS_080\"]},{\"FR\":[\"PS_03A\",\"PS_03B\",\"PS_03C\",\"PS_05A\",\"PS_05B\",\"PS_070\",\"PS_080\"]},{\"IE\":[\"PS_03A\",\"PS_03B\",\"PS_03C\",\"PS_05A\",\"PS_05B\",\"PS_070\",\"PS_080\"]},{\"IT\":[\"PS_03A\",\"PS_03B\",\"PS_03C\",\"PS_05A\",\"PS_05B\",\"PS_070\",\"PS_080\"]},{\"LU\":[\"PS_03A\",\"PS_03B\",\"PS_03C\",\"PS_05A\",\"PS_05B\",\"PS_070\",\"PS_080\"]},{\"MT\":[\"PS_03A\",\"PS_03B\",\"PS_03C\",\"PS_05A\",\"PS_05B\",\"PS_070\",\"PS_080\"]},{\"NL\":[\"PS_03A\",\"PS_03B\",\"PS_03C\",\"PS_05A\",\"PS_05B\",\"PS_070\",\"PS_080\"]},{\"PL\":[\"PS_03A\",\"PS_03B\",\"PS_03C\",\"PS_05A\",\"PS_05B\",\"PS_070\",\"PS_080\"]},{\"PT\":[\"PS_03A\",\"PS_03B\",\"PS_03C\",\"PS_05A\",\"PS_05B\",\"PS_070\",\"PS_080\"]}],\"services_raw\":[{\"AT\":[\"PS_03A\",\"PS_03B\",\"PS_03C\",\"PS_05A\",\"PS_05B\",\"PS_070\",\"PS_080\"]},{\"BE\":[\"PS_03A\",\"PS_03B\",\"PS_03C\",\"PS_05A\",\"PS_05B\",\"PS_070\",\"PS_080\"]},{\"DE\":[\"PS_03A\",\"PS_03B\",\"PS_03C\",\"PS_05A\",\"PS_05B\",\"PS_070\",\"PS_080\"]},{\"ES\":[\"PS_03A\",\"PS_03B\",\"PS_03C\",\"PS_05A\",\"PS_05B\",\"PS_070\",\"PS_080\"]},{\"FI\":[\"PS_03A\",\"PS_03B\",\"PS_03C\",\"PS_05A\",\"PS_05B\",\"PS_070\",\"PS_080\"]},{\"FR\":[\"PS_03A\",\"PS_03B\",\"PS_03C\",\"PS_05A\",\"PS_05B\",\"PS_070\",\"PS_080\"]},{\"IE\":[\"PS_03A\",\"PS_03B\",\"PS_03C\",\"PS_05A\",\"PS_05B\",\"PS_070\",\"PS_080\"]},{\"IT\":[\"PS_03A\",\"PS_03B\",\"PS_03C\",\"PS_05A\",\"PS_05B\",\"PS_070\",\"PS_080\"]},{\"LU\":[\"PS_03A\",\"PS_03B\",\"PS_03C\",\"PS_05A\",\"PS_05B\",\"PS_070\",\"PS_080\"]},{\"MT\":[\"PS_03A\",\"PS_03B\",\"PS_03C\",\"PS_05A\",\"PS_05B\",\"PS_070\",\"PS_080\"]},{\"NL\":[\"PS_03A\",\"PS_03B\",\"PS_03C\",\"PS_05A\",\"PS_05B\",\"PS_070\",\"PS_080\"]},{\"PL\":[\"PS_03A\",\"PS_03B\",\"PS_03C\",\"PS_05A\",\"PS_05B\",\"PS_070\",\"PS_080\"]},{\"PT\":[\"PS_03A\",\"PS_03B\",\"PS_03C\",\"PS_05A\",\"PS_05B\",\"PS_070\",\"PS_080\"]}]},\"record_key\":{\"EntityCode\":\"IE_CBI!C58301\",\"EntityType\":\"PSD_PI\",\"EntityVersion\":\"20260814223344848\"}}","register_id":"EBA_PSD2_REGISTER","retrieved_at":"2026-09-13","source_as_of":"2026-09-13","source_date_reliability":"TRUSTED","source_url":"https://euclid.eba.europa.eu/register/downloads/PSDMD/20260913/download-PSDMD-202609130800.zip"}],"legal_basis":"autorizacion PI home NCA (IE_CBI, 2018-07-02) + PSD2 art. 28 LPS + Reg. Delegado (UE) 2017/2055: servicios passportados a ES reportados por la NCA de origen via EBA; entry_mechanism permanece AUTHORISATION (la comunicacion territorial no lo muta)","reason":"IN_EFFECT","register_id":"EBA_PSD2_REGISTER","source_legal_effect":"ENTITLED_TO_PROVIDE"}],"assessment":"CONFIRMED_ENTITLED","case_id":"G1D-01","derived_assertion_ids":[],"diagnostics":[],"entry_mechanism_match":true,"entry_mechanisms":["AUTHORISATION"],"expected_assessment":"CONFIRMED_ENTITLED","expected_entry_mechanism":"AUTHORISATION","expected_reason":"ACTIVE_ENTITLEMENT_EVIDENCED","expected_territorial_basis":["FREEDOM_TO_PROVIDE_SERVICES"],"identity_resolution":"EXACT","legal_basis_match":true,"match":true,"matched_reported_fact_ids":[],"matching_assertion_ids":["g1d2-asm-077"],"query":{"activity":"PAYMENT_SERVICES","as_of":"2026-09-14","entity_id":"G1D-001","jurisdiction":"ES"},"reason":"ACTIVE_ENTITLEMENT_EVIDENCED","reason_match":true,"source_claim_ids":["G1D-001|EBA_PSD2_REGISTER|PSD_PI:IE_CBI!C58301|commercial_name","G1D-001|EBA_PSD2_REGISTER|PSD_PI:IE_CBI!C58301|country","G1D-001|EBA_PSD2_REGISTER|PSD_PI:IE_CBI!C58301|ent_aut_raw","G1D-001|EBA_PSD2_REGISTER|PSD_PI:IE_CBI!C58301|ent_aut_raw_type","G1D-001|EBA_PSD2_REGISTER|PSD_PI:IE_CBI!C58301|entity_code","G1D-001|EBA_PSD2_REGISTER|PSD_PI:IE_CBI!C58301|entity_type","G1D-001|EBA_PSD2_REGISTER|PSD_PI:IE_CBI!C58301|entity_version","G1D-001|EBA_PSD2_REGISTER|PSD_PI:IE_CBI!C58301|legal_name","G1D-001|EBA_PSD2_REGISTER|PSD_PI:IE_CBI!C58301|national_reference_code","G1D-001|EBA_PSD2_REGISTER|PSD_PI:IE_CBI!C58301|service_codes","G1D-001|EBA_PSD2_REGISTER|PSD_PI:IE_CBI!C58301|services_raw"],"strict_divergences":[],"strict_exact_set_match":true,"territorial_bases":["FREEDOM_TO_PROVIDE_SERVICES"],"territorial_basis_match":true,"used_assertion_ids":["g1d2-asm-077"]},{"assertion_evaluations":[{"assertion_id":"g1d2-asm-078","effective_from":"2024-06-26","effective_legal_effect_at_as_of":"ENTITLED_TO_PROVIDE","effective_to":null,"evidence":[{"authority":"European Banking Authority (EBA)","extractor_version":"G1D_TERRITORIAL_EXTRACT_V1","observed_current":true,"raw_snapshot_sha256":"948429ad71ea0ccbc03abe8d21eab7082075e09377874852b0fd265c2e0e1f31","raw_value":"{\"fields\":{\"country\":\"ES\",\"der_chi_ent_aut\":\"Active\",\"ent_cod_par_ent\":\"PSD_PI!PT_BP!8709\",\"ent_typ_par_ent\":\"PSD_PI\",\"entity_code\":\"PSD_PI!PT_BP!8709\",\"entity_type\":\"PSD_BR\",\"entity_version\":\"20260909084530565\",\"legal_name\":\"EUPAGO - INSTITUIÇÃO DE PAGAMENTO, LDA.\",\"national_reference_code\":null,\"service_codes\":[{\"ES\":[\"PS_03A\",\"PS_03B\",\"PS_03C\",\"PS_05A\",\"PS_05B\",\"PS_060\",\"PS_070\",\"PS_080\"]}],\"services_raw\":[{\"ES\":[\"PS_03A\",\"PS_03B\",\"PS_03C\",\"PS_05A\",\"PS_05B\",\"PS_060\",\"PS_070\",\"PS_080\"]}]},\"record_key\":{\"EntityCode\":\"PSD_PI!PT_BP!8709\",\"EntityType\":\"PSD_BR\",\"EntityVersion\":\"20260909084530565\"}}","register_id":"EBA_PSD2_REGISTER","retrieved_at":"2026-09-13","source_as_of":"2026-09-13","source_date_reliability":"TRUSTED","source_url":"https://euclid.eba.europa.eu/register/downloads/PSDMD/20260913/download-PSDMD-202609130800.zip"},{"authority":"European Banking Authority (EBA)","extractor_version":"G1D_TERRITORIAL_EXTRACT_V1","observed_current":true,"raw_snapshot_sha256":"948429ad71ea0ccbc03abe8d21eab7082075e09377874852b0fd265c2e0e1f31","raw_value":"{\"fields\":{\"commercial_name\":\"Eupago\",\"country\":\"PT\",\"ent_aut_raw\":[\"2015-04-13\"],\"ent_aut_raw_type\":[\"2015-04-13\"],\"entity_code\":\"PSD_PI!PT_BP!8709\",\"entity_type\":\"PSD_PI\",\"entity_version\":\"20251030231925863\",\"legal_name\":\"Eupago - Instituição de Pagamento Lda\",\"national_reference_code\":\"8709\",\"service_codes\":[{\"ES\":[\"PS_03A\",\"PS_03B\",\"PS_03C\",\"PS_05A\",\"PS_05B\",\"PS_060\"]},{\"PT\":[\"PS_03A\",\"PS_03B\",\"PS_03C\",\"PS_05A\",\"PS_05B\",\"PS_060\",\"PS_070\",\"PS_080\"]}],\"services_raw\":[{\"ES\":[\"PS_03A\",\"PS_03B\",\"PS_03C\",\"PS_05A\",\"PS_05B\",\"PS_060\"]},{\"PT\":[\"PS_03A\",\"PS_03B\",\"PS_03C\",\"PS_05A\",\"PS_05B\",\"PS_060\",\"PS_070\",\"PS_080\"]}]},\"record_key\":{\"EntityCode\":\"PSD_PI!PT_BP!8709\",\"EntityType\":\"PSD_PI\",\"EntityVersion\":\"20251030231925863\"}}","register_id":"EBA_PSD2_REGISTER","retrieved_at":"2026-09-13","source_as_of":"2026-09-13","source_date_reliability":"TRUSTED","source_url":"https://euclid.eba.europa.eu/register/downloads/PSDMD/20260913/download-PSDMD-202609130800.zip"},{"authority":"Banco de Espana","extractor_version":"G1D_TERRITORIAL_EXTRACT_V1","observed_current":true,"raw_snapshot_sha256":"ea889fa101ec5f2c373b7f702412aa133479653b042e9290d913f93b1888b6f8","raw_value":"{\"fields\":{\"codigo_be\":\"6938\",\"fecha_alta\":\"26/06/2024\",\"fecha_baja\":null,\"legal_name\":\"EUPAGO INSTITUIÇÃO DE PAGAMENTO, SUCURSAL EN ESPAÑA LDA\",\"nombre_matriz\":\"EUPAGO - INSTITUIÇAO DE PAGAMENTO, LDA.\",\"pais_origen\":\"PT\",\"tipo_entidad\":\"Sucursal de entidad de pago extranjera comunitaria\"},\"record_key\":{\"field\":\"CÓDIGO BE\",\"value\":\"6938\"}}","register_id":"BDE_REGISTRO_SERVICIOS_PAGO","retrieved_at":"2026-09-14","source_as_of":"2026-09-10","source_date_reliability":"TRUSTED","source_url":"https://www.bde.es/f/webbe/SGE/regis/ficheros/es/Registro_ServicioPagos.xlsx"}],"legal_basis":"autorizacion PI home NCA (PT_BP, 2015-04-13) + PSD2 art. 28 establecimiento + PSD2 art. 28 sucursal (BdE 6938, 26/06/2024): inscripcion sucursal BdE 6938 (26/06/2024) demostrada; la actividad inicia tras inscripcion","reason":"IN_EFFECT","register_id":"EBA_PSD2_REGISTER","source_legal_effect":"ENTITLED_TO_PROVIDE"},{"assertion_id":"g1d2-asm-079","effective_from":"2026-09-14","effective_legal_effect_at_as_of":"ENTITLED_TO_PROVIDE","effective_to":null,"evidence":[{"authority":"European Banking Authority (EBA)","extractor_version":"G1D_TERRITORIAL_EXTRACT_V1","observed_current":true,"raw_snapshot_sha256":"948429ad71ea0ccbc03abe8d21eab7082075e09377874852b0fd265c2e0e1f31","raw_value":"{\"fields\":{\"commercial_name\":\"Eupago\",\"country\":\"PT\",\"ent_aut_raw\":[\"2015-04-13\"],\"ent_aut_raw_type\":[\"2015-04-13\"],\"entity_code\":\"PSD_PI!PT_BP!8709\",\"entity_type\":\"PSD_PI\",\"entity_version\":\"20251030231925863\",\"legal_name\":\"Eupago - Instituição de Pagamento Lda\",\"national_reference_code\":\"8709\",\"service_codes\":[{\"ES\":[\"PS_03A\",\"PS_03B\",\"PS_03C\",\"PS_05A\",\"PS_05B\",\"PS_060\"]},{\"PT\":[\"PS_03A\",\"PS_03B\",\"PS_03C\",\"PS_05A\",\"PS_05B\",\"PS_060\",